"Массажёр Фараон","<p>Несмотря на простые формы <strong>массажер Фараон</strong> выполняет широкий спектр действий. Сделанный подобно геометрической фигуре, массажер имеет специальные бугорки-выступы, образующие сочетание сложных линз, которые, в свою очередь, фокусируют светоэнергетические пучки и направляют их на массируемую поверхность. На одном из шаров имеется так называемая «корона». Преимущества данного массажера заключается именно в уникальной его конструкции. Четыре плоскости с различными радиусами кривизны рабочих выступов выполняют четыре вида общего и сегментарного массажа и пять видов — точечного.</p><p><b>Сегментарный массаж</b> оказывает положительное воздействие на все системы организма, нормализует работу внутренних органов. Он регулирует вегетативные функции организма — дыхание, кровообращение и пищеварение, усиливает секреторную функцию сальных и потовых желез.</p><p><b>Точечный массаж</b> является одним из методов рефлексотерапии. Он воздействует на биологически активные точки (основные точки расположены на лице, руках и ногах), оказывая терапевтическое и профилактическое действие. Такой массаж ведет свои истоки с Востока и сегодня используется повсеместно.</p><p>Известно, что причиной многих болезней является нервное истощение, вследствие чего происходят энергетические сбои. Там, где скапливается энергия, происходит перенапряжение мышц и переработка внутренних систем организма. Происходят застои шлаков, вредных веществ в организме, создаются условия для появления опухолей, нарушается обмен веществ.</p><p>Наладить естественный баланс организма поможет массажер Фараон. В этом массажере заложена идея трехгранной пирамиды, которая, являясь прообразом четырехгранной пирамиды, унаследовала ее целительные свойства. </p><p>За счет необычной конструкции массажера можно осуществлять массаж разного вида и степени воздействия. Кроме благоприятного воздействия на внутренние органы массажер разрушает целлюлитные отложения и активизирует кровообращение. Такой массаж разрушает соединительно-тканные перегородки между жировыми клетками, в результате чего создаются условия для активизации объемных процессов и расщепления жира. Также он уменьшает болевые ощущения при остеохондрозе, радикулите, мигрени.</p><p>Помимо домашнего использования <strong>массажер Фараон </strong>применяют в качестве лечебного средства в мануальной терапии, реабилитационных центрах, кабинетах ЛФК, амбулаторных и поликлинических службах. </p><p><b>Особенности:</b></p><ul type=disc><li>Массажер можно применять, работая с различной интенсивностью. Для этого следует повернуть его таким образом, чтобы выбранные Вами выступы массажера находились в районе рабочей поверхности. Чем острее выступы, тем более глубоки Легкий массаж- это мягкое поверхностное массирование шарами с большими радиусами (основание пирамиды). <li>Более выраженный массаж осуществляется большими полусферами, расположенными на основных шарах; при этом происходит воздействие на поверхностные слои мышц. <li>Глубокий массаж выполняется конусовидными выступами с шаровидными вершинами: мышцы при этом прорабатываются на всю глубину. <li>Высокоэффективный массаж - наиболее интенсивный, служит для глубокой обработки мышц, связок и массажа до надкостницы; проводится самыми острыми — конусовидными — выступами.й и интенсивный массаж они позволяют производить. <li>Во время сеанса, который рекомендуется проводить через 10-15 мин после еды, 1-2 раза в день, следует выполнять в течение 7 мин круговые движения по часовой стрелке (или вверх-вниз). <li>Массирование одним шариком или каким-либо его выступом используется для массажа отдельных мышечных групп (межреберные мышцы, мышцы кисти и стопы). <li>Массаж с помощью «короны» применяется на кистях рук и стопах, так как здесь имеются точки малого размера для воздействия на все органы человека. <li>Массирование одновременно двумя шариками применяют для массажа длинных мышц спины и мышечных групп голени, бедра, плеча, околопозвонковых мышечных групп. Можно проводить антицеллюлитный массаж, перемещая массажер вверх от колена к бедру.</li></ul><p><strong>Производство:</strong> Россия </p>","260","http://profit-shop.ru/shop/UID_779.html","2af53540787e858b003d24b15fc92f87.jpeg"
"Массажёр Фараон-М","<p>Несмотря на простые формы <strong>массажер Фараон </strong>выполняет широкий спектр действий. Сделанный подобно геометрической фигуре, массажер имеет специальные бугорки-выступы, образующие сочетание сложных линз, которые, в свою очередь, фокусируют светоэнергетические пучки и направляют их на массируемую поверхность. На одном из шаров имеется так называемая «корона». Преимущества данного массажера заключается именно в уникальной его конструкции. Четыре плоскости с различными радиусами кривизны рабочих выступов выполняют четыре вида общего и сегментарного массажа и пять видов — точечного.</p><p><b>Сегментарный массаж</b> оказывает положительное воздействие на все системы организма, нормализует работу внутренних органов. Он регулирует вегетативные функции организма — дыхание, кровообращение и пищеварение, усиливает секреторную функцию сальных и потовых желез.</p><p><b>Точечный массаж</b> является одним из методов рефлексотерапии. Он воздействует на биологически активные точки (основные точки расположены на лице, руках и ногах), оказывая терапевтическое и профилактическое действие. Такой массаж ведет свои истоки с Востока и сегодня используется повсеместно.</p><p>Примечательно, что массажер изготовлен из износостойкого полимера, который не электризуется. Для усиления эффекта в основание <strong>массажера «Фараон-М» </strong>встроен магнит, который создает постоянное магнитное поле адаптированной для человеческого организма величины. С давних пор известно полезное действие магнитотерапии. Под воздействием магнита происходит регенерация в тканях, образуются новые клетки, стимулируется кровеносное циркулирование. С помощью магнитотерапии лечатся гематомы, ушибы, болезни суставов и костей.</p><p><strong>Показания к применению</strong></p><ul type=disc><li>заболевания и повреждения опорно-двигательного аппарата (остеохондроз, деформирующий спондилез, остеоартроз, остеопороз и т. д.; переломы, ушибы и т. д.); <li>заболевания нервной системы (цереброваскулярная патология, травмы периферических нервов, неврозы, нарушения сна); <li>подострые и хронические заболевания мочеполовой сферы; <li>болезни органов дыхания (хронический обструктивный бронхит и бронхиальная астма); <li>болезни эндокринной системы (гипофункция щитовидной железы); <li>патология сердечно-сосудистой системы (нейроциркуляторная дистония по гипертоническому типу); <li>патология периферических сосудов (варикозная болезнь, облитерирующий эндартериит, с-м Рейно, диабетическая ангиопатия и т. д.;. <li>косметология (для коррекции формы тела, при целлюлите, при старении кожи тела, при кожном зуде, гематомах, отёках); <li>спортивная медицина (восстановление биологических ритмов после пересечения нескольких часовых поясов, снятие стрессовых нагрузок перед стартом, повышение физической и психической работоспособности, лечебно-профилактические мероприятия, связанные со спортивными травмами). </li></ul><p><strong>Противопоказания</strong></p><p>Магнитотерапия, несмотря на всю природную естественность метода, имеет противопоказания:</p><ul type=disc><li>наличие искусственного водителя ритма (кардиостимулятора); <li>острый тромбоз, аневризма сердца и крупных сосудов; <li>выраженная гипотония; <li>сложные нарушения сердечного ритма; пониженная частота пульса (брадикардия); <li>гиперфункция щитовидной железы (тиреотоксикоз); <li>онкологические заболевания; <li>эпилепсия; <li>возраст (не рекомендуется детям до 2 лет). </li></ul><p><strong>Не рекомендуется делать массаж</strong></p><ul type=disc><li>при наличии гнойничков (фурункулов) и других выраженных повреждений кожного покрова; <li>в зоне увеличенных лимфатических узлов; <li>при заболеваниях, сопровождающихся высокой температурой тела. </li></ul><p><strong>Рекомендации по применению</strong></p><p> <strong>Массажер «Фараон-М»</strong> рекомендован для применения в специализированных центрах массажа и мануальной терапии, в реабилитационных центрах, кабинетах ЛФК, лечебных и санаторно-оздоровительных учреждениях, в домашних условиях.</p><p><strong>Производство:</strong> Россия </p>","260","http://profit-shop.ru/shop/UID_780.html","0f804e21b3b864128c310dab356b8737.jpeg"
"Аппликатор Ляпко Шанс 4,9","<p>Аппликатор – это своего рода «игольчатый доктор», который путем воздействия на определенные зоны способен восстанавливать организм в целом, так и его системы в отдельности.</p><p>Аппликатор представляет собой специальную эластичную резиновую пластину, на которой крепятся иглы, состоящие из различных металлов, среди которых железо, медь, цинк, никель, серебро. В резиновой основе вокруг игл и по краям аппликатора имеются ограничительные выступы, предохраняющие кожу пациента от избыточного проникновения игл и от повреждения.</p><p><strong>Особенности: </strong></p><ul type=disc><li>повышает работоспособность и жизненный тонус, нормализует сон и обмен веществ, улучшает настроение; <li>помогает в лечении заболеваний желудочно-кишечного тракта, сердечно-сосудистой, дыхательной и нервной систем, нормализует их деятельность; <li>устраняет половые расстройства с последующей нормализацией половых функций у мужчин и женщин; при лечении гинекологических заболеваний способствует быстрому устранению воспалительных явлений и нарушений овариальноменструального цикла; <li>сокращает время полноценного восстановления после черепно-мозговых травм, переломов, операций, инсультов; снимает боли в позвоночнике, суставах и мышцах, а также головные боли; <li>повышает в 2-3 раза эффективность таких методов, как массаж, ушная и общая иглотерапия, мануальная и лазеротерапия, микроволновая резонансная терапия (при совместном или предварительном применении); <li>позволяет сократить прием лекарств, а то и вовсе отказаться от них. </li></ul><p><strong>Техническая характеристика: </strong></p><ul type=disc><li>Ширина: 105 мм. <li>Длина: 235 мм. <li>Шаг: 4,9 мм. </li></ul><p><strong>Производство: </strong>Россия </p>","760","http://profit-shop.ru/shop/UID_799.html","92c16d267d16556f4f9df2ed4ab4d8db.jpeg"
"Аппликатор Ляпко Коврик 6,8","<p>Аппликатор – это своего рода «игольчатый доктор», который путем воздействия на определенные зоны способен восстанавливать организм в целом, так и его системы в отдельности.</p><p>Аппликатор представляет собой специальную эластичную резиновую пластину, на которой крепятся иглы, состоящие из различных металлов, среди которых железо, медь, цинк, никель, серебро. В резиновой основе вокруг игл и по краям аппликатора имеются ограничительные выступы, предохраняющие кожу пациента от избыточного проникновения игл и от повреждения.</p><p>Регулярное использование массажера позволяет нормализовать обмен веществ, нормализует сон. Игольчатый массажер помогает при лечении заболеваний желудочно-кишечного тракта, сердечно-сосудистой, дыхательной и нервной систем. Его часто используют как болеутоляющее средство.</p><p><strong>Особенности:</strong></p><ul type=disc><li>повышает работоспособность и жизненный тонус, нормализует сон и обмен веществ, улучшает настроение; <li>помогает в лечении заболеваний желудочно-кишечного тракта, сердечно-сосудистой, дыхательной и нервной систем, нормализует их деятельность; <li>устраняет половые расстройства с последующей нормализацией половых функций у мужчин и женщин; при лечении гинекологических заболеваний способствует быстрому устранению воспалительных явлений и нарушений овариальноменструального цикла; <li>сокращает время полноценного восстановления после черепно-мозговых травм, переломов, операций, инсультов; снимает боли в позвоночнике, суставах и мышцах, а также головные боли; <li>повышает в 2-3 раза эффективность таких методов, как массаж, ушная и общая иглотерапия, мануальная и лазеротерапия, микроволновая резонансная терапия (при совместном или предварительном применении); <li>позволяет сократить прием лекарств, а то и вовсе отказаться от них. </li></ul><p><strong>Техническая характеристика: </strong></p><ul type=disc><li>Ширина: 250 мм. <li>Длина: 465 мм. <li>Шаг: 6,8 мм. </li></ul><p><strong>Производство:</strong> Россия </p>","2720","http://profit-shop.ru/shop/UID_839.html","234e7f009134ec4e716a50e2c790eb7e.jpeg"
"Массажер роликовый Юниор","<p><strong>Массажер Юниор</strong> относится к роликовым, он позволяет расслабиться при перегрузках, залечивает травмы, препятствует образованию морщин, повышает эффект воздействия косметических средств. «Волшебные пальчики» массажера помогут постепенно избавиться от целлюлита, расправить кожу. Механическое воздействие прибора стимулирует кровообращение. Ролики Юниора легко поворачиваются в разные направления, следуя анатомическому строению человека. Массажер избавит от боли, поможет при травмах, ушибах и вернет бодрость и оптимизм. Спектр применения роликового массажера достаточно широк: это и руки, и лицо, и ноги, и грудь, словом любой участок тела.</p><p><b>Производитель:</b> ООО «Дельта-Терм» (Россия, Москва)</p>","200","http://profit-shop.ru/shop/UID_1153.html","204ba8d6c75baeef17b6e79f51f1b650.jpeg"
"Массажер роликовый Мастер","<p><strong>Роликовый массажер Мастер </strong>прост в использовании и эффективен в действии. Вы просто водите им по телу и получаете удовольствие. Мышцы расслабляются, кровоток увеличивается, кожа разглаживается. Четыре пары роликов мягко массируют кожу, постепенно избавляя вас от целлюлитных образований. Кроме этого легкий компактный прибор дает возможность обрабатывать труднодоступные участки и суставы.</p><p><b>Производитель:</b> ООО «Дельта-Терм» (Россия, Москва)</p>","290","http://profit-shop.ru/shop/UID_1154.html","741c2a17d20645ac77bf0cd8e2974fe0.jpeg"
"Массажер роликовый Чемпион","<p><strong>Роликовый массажер Чемпион </strong>довольно большого размера и позволяет обрабатывать обширные участки тела. В сложенном виде его легко использовать для массажа стоп. Чемпион применяется профессиональными массажистами. Восемь пар роликов плавно водят по поверхности кожи, расслабляя напряженные мышцы, стимулируя кровообращение. Приобретая механический массажер Чемпион для домашнего использования, вы можете самостоятельно проводить оздоравливающие процедуры.</p><p><b>Производитель:</b> ООО «Дельта-Терм» (Россия, Москва)</p>","410","http://profit-shop.ru/shop/UID_1155.html","36576e883789273d56cbf397e3ca9ef9.jpeg"
