"Прибор косметический многофункциональный Gezatone Galvanic Beauty SPA M777","<p><b>Многофункциональный косметический прибор Gezatone Galvanic Beauty SPA</b> – это инновационный уход, который объединяет в себе медицинское восстановление и косметический уход за кожей по четырем основным функциям: очищение, массаж и увлажнение, питание, лифтинг. С этим аппаратом Вам больше не придется тратить время и деньги на походы к косметологу, чтобы омолодить, оживить и оздоровить кожу лица. Воспользуйтесь всеми возможностями прибора, не выходя из дома! Благодаря компактному эргономичному дизайну, можно брать устройство с собой на работу или в дорогу.</p><p>Функция очищения служит для того, чтобы создавать высокоэнергичные группы частиц, разрушающих меланин и стареющие клетки в слое эпидермиса, которые ежедневно образуются там в большом количестве, и, как известно, приводят к изменению цвета лица. Массажная функция <b>Gezatone Galvanic Beauty SPA</b> заключается в том, что прибор электролизует воду в коже с образованием ионов, затем направляет их вглубь благодаря отталкивающему эффекту однополярных ионов. Это позволяет клеткам кожи отлично впитывать жидкость и поддерживать влажность кожи в течение 24 часов, предотвращая сухость и образование морщин.</p><p>Кожа ежедневно нуждается в дополнительном питании, так как его недостаток неизменно приводит к ее старению. Прибор расщепляет косметическое питание на растворимые в воде ионы и направляет их непосредственно в кожу, что позволяет клеткам, в особенности подкожной клетчатке, отвечающей за выработку коллагена, получать необходимое питание и продлевать тем самым жизнь кожи. Функция лифтинга стимулирует волокна верхнего слоя кожи постоянно вырабатывать коллаген в соответствии с дневной нормой для восстановления ее эластичности. Таким образом вы избавитесь от морщин и сохраните кожу упругой и подтянутой.</p><p><b>Режимы работы (включите аппарат, последовательно нажимая кнопку «</b><b>Mode </b><b>Select» выберите 1 из 4-х возможных режимов):</b></p><ol type=1><li>Чистка (Cleaning): на активный электрод подается постоянное напряжение положительной полярности (+), также включены вибромассаж и инфракрасная функция; <li>Массаж и увлажнение (Massage): на активный электрод подаются импульсы напряжения длительностью 45 мс с чередующейся полярностью (+/–), также включены вибромассаж и инфракрасная функция; <li>Питание (Nutrient): на активный электрод подается постоянное напряжение отрицательной (–) полярности, включены вибромассаж и инфракрасная функция; <li>Лифтинг (Lifting): на активный электрод подаются имульсы напряжения длительностью 400 мс с чередующейся полярностью (+/–).</li></ol><p><b>Характеристики:</b></p><ul type=disc><li>Напряжение питания DC 3 В (от встроенного аккумулятора); <li>Ток потребления не более 120 мА; <li>Выходной сигнал в монополярных режимах: Cleaning / Nutrient пост. напряжение ± 9/18 В <li>Выходной сигнал в биполярных импульсных режимах: Massage ± 8/15 В, длит. импульсов 45 мс; Lifting ± 8/15 В, длит. импульсов 400 мс; <li>Вибромассаж 4 сек работает, 1 сек пауза (во всех режимах, кроме режима Lifting); <li>Диапазон рабочих температур: +15 ... 35°С при влажности 20 ... 85%; <li>Размеры упаковки 240х 230х65 мм; <li>Масса в упаковке 0,55 кг.</li></ul><p><b>Комплектация:</b></p><ul type=disc><li>Аппарат; <li>База для зарядки встроенных аккумуляторов 1 шт.; <li>Сетевой адаптер 1 шт.; <li>Инструкция по эксплуатации; <li>Упаковочная коробка.</li></ul><p><b></b></p><p><b>Противопоказания:</b></p><ul type=disc><li>Заболевания сердечнососудистой системы выше 2Б степени, использование электрокардиостимулятора; <li>Период беременности; <li>Эпилепсия, сахарный диабет, рассеянный склероз; <li>Злокачественные онкологические заболевания; <li>Наличие нарушений чувствительности кожи (болевой и температурной) в области применения аппарата; <li>Нарушение целостности кожных покровов (травмы, ссадины), послеоперационный период, дерматологические заболевания (экзема, дерматит), не использовать на родимых пятнах; <li>Острые воспалительные процессы, гнойнички, воспаление сальных желез; <li>Наличие подкожных силиконовых имплантантов; <li>В течение периода действия инъекций ботокса; <li>Перед использованием аппарата после косметических и пластических операций и операций с применением имплантов из металлических материалов необходимо предварительно проконсультироваться с врачом; <li>При наличии металлических зубных протезов, брекетов и т.п. рекомендуется изолировать их от воздействия гальванического тока, поместив между зубами и губой кусочек токонепроводящего материала (тонкий пластик, пленка); <li>При аллергии на металл следует воспользоваться нетканой маской, пропитанной косметическим средством, в качестве промежуточной среды; <li>При выполнении процедур не затрагивайте параорбитальную зону (глазное яблоко), слизистую губ и зону проекции щитовидной железы.</li></ul><p><b>Производитель:</b> Gezanne.</p><p><b>Страна:</b> Франция.</p>","2920","http://profit-shop.ru/shop/UID_12289.html","11b3a075c8613dd1b4690f824cd1ef8e.jpeg"
"Прибор гальванический для ухода за кожей Gezatone Beauty Lifting m910","<p>Портативный <b>гальванический прибор</b> <b>для комплексного ухода за кожей лица</b> <b>Gezatone Beauty Lifting</b> – это безоперационный лифтинг в домашних условиях, обеспечивающий улучшение тургора, цвета и общего внешнего вида кожи. С этим аппаратом Вы сможете самостоятельно проводить процедуры по тонизации и упругости кожи, разглаживанию морщин, моделированию овала лица, восстановлению и нормализации процессов обмена веществ. <b>Gezatone Beauty Lifting</b> применяет постоянный гальванический ток. Воздействие проводится с положительной или отрицательной полярностью электрода-ролика.</p><p>Положительная полярность позволяет эффективно очистить кожу от различных шлаков и токсинов, повысить тонус дряблой кожи, увлажнить ее, восстановить тургор, активизировать тонус сосудов и улучшить цвет лица, стимулировать трофику тканей и кислородное дыхание клеток кожи, открыть поры, расщепить и омылить кожный жир – себум. Отрицательная полярность помогает ввести активные косметические препараты в глубокие слои кожи. Она снимает повышенный тонус мимических мышц лица, разглаживая при этом морщины на лбу, переносице, вокруг рта, в уголках глаз. Также при отрицательной полярности электрода-ролика уменьшается раздражение и воспаление кожи, устраняются отеки и выводятся токсины, снимаются аллергические реакции, зуд, покраснения, уменьшаются проявления купероза. Кроме того, сужаются поры, кожа приобретает свежий здоровый вид. Использование переменной полярности отлично подходит для увлажняющих процедур. Ионизация с помощью электрода-ролика улучшает лимфообмен, овал лица, уменьшает отеки, способствует лифтингу. </p><p><b>Комплектация: </b></p><ul type=disc><li>Аппарат; <li>Инструкция по эксплуатации; <li>Упаковочная коробка. </li></ul><p><b>Производитель:</b> Gezanne.</p><p><b>Страна:</b> Франция.</p>","1000","http://profit-shop.ru/shop/UID_12291.html","0e36d5a33ba12bef9e55f0ef96a3960d.jpeg"
"Прибор для ухода за кожей Gezatone Bio Wave m920","<p><b>Gezatone Bio Wave</b> представляет собой компактный косметический прибор, который предназначен для комплексного интенсивного ухода за кожей лица в домашних условиях. Он снабжен функцией «микротоки», являющейся одной из самых популярных и эффективных в косметологии. С ее помощью можно мягко и деликатно воздействовать на функциональную активность клеток кожи, на мышцы, лимфатические и кровеносные сосуды. Процедура стимуляции микротоками получила название «безоперационного лифтинга», т.к. она быстро и эффективно способствует корректировке овала лица, укреплению и омоложению кожи.</p><p>Лимфодренаж обеспечивает устранение отеков и одутловатости лица. Тонизация мышц предусматривает тонизацию в следующих областях: лоб, переносица и между бровями, шея и носогубные складки, губы и «гусиные лапки» около глаз, щеки и боковые стороны лица, подбородок. Благодаря этой функции исчезает «второй подбородок» и подтягиваются мышцы шеи.</p><p><b>Основные функции: </b></p><ul type=disc><li>Разглаживает морщины, обладает мощным омолаживающим действием; <li>Повышает эластичность и тонус кожи лица; <li>Обеспечивает безоперационную подтяжку кожи лица; <li>Уменьшает отечность, ликвидирует застойные явления в тканях кожи лица; <li>Улучшает микроциркуляцию и лимфоток; <li>Активизирует питание, обогащение клеток кожи кислородом; <li>Способствует улучшению цвета и внешнего вида кожи лица и шеи. </li></ul><p><b></b></p><p><b>Комплектация: </b></p><ul type=disc><li>Аппарат; <li>Инструкция по эксплуатации; <li>Упаковочная коробка. </li></ul><p><b>Производитель:</b> Gezanne.</p><p><b>Страна:</b> Франция.</p>","1100","http://profit-shop.ru/shop/UID_12292.html","b6354d226c8e04e9b88a5ad24218f045.jpeg"
"Прибор ультразвуковой для ухода за кожей лица и тела Gezatone SuperSonic m350","<p><b>Ультразвуковой прибор</b> <b>Gezatone </b><b>SuperSonic</b> служит для высококлассного косметического ухода за кожей лица и тела в домашних условиях. При регулярном использовании аппарата кожа очищается, улучшается ее эластичность, повышается упругость. В основе работы устройства лежит метод «сонодермии», активно и успешно применяемый в профессиональной физиотерапии и косметологии уже на протяжении долгого времени. Во время работы излучатель прибора генерирует ультразвуковые колебания, которые заставляют ткани и клетки кожи волнообразно менять свою плотность. Такой деликатный массаж тканей на клеточном уровне оказывает мощное стимулирующее действие, не растягивая и не травмируя кожу. </p><p>Ультразвуковой микромассаж активизирует обмен веществ в клетках дермы, повышает уровень синтеза клетками коллагена и эластина, которые, как известно, придают тканям упругость и эластичность. Одновременно осуществляется разглаживание морщинок и борозд, активизируется циркуляция крови и лимфы. Массаж хорошо влияет на работу сальных и потовых желез, превосходно разравнивает поверхность кожи, рубцы, постакне и различные воспалительные уплотнения.</p><p><b>Характеристики:</b></p><ul type=disc><li>Напряжение питания: DC 15 В; <li>Потребляемый ток: не более 230 мА; <li>Размеры в упаковке: 25х18х6,5 см; <li>Вес: 190 г. </li></ul><p><b>Комплектация:</b></p><ul type=disc><li>Аппарат; <li>Руководство по эксплуатации; <li>Сетевой адаптер АС 220 В, 50 Гц / DC 15 B, 0,35 А. </li></ul><p><b>Ультразвуковой микромассаж применяется при: </b></p><ul type=disc><li>Сухой дегидратированной коже; <li>Мимических морщинах; <li>Грубой ороговевшей коже; <li>Рубцовых изменениях кожи (растяжки); <li>Гиперпигментации; <li>Лимфостазе; <li>Жирной пористой коже, особенно с постакне; <li>Дряблой коже со сниженным мышечным тонусом; <li>Борьбе с целлюлитом всех форм и стадий (особенно отечного и фиброзного). </li></ul><p><b>Производитель:</b> Gezanne.</p><p><b>Страна:</b> Франция.</p>","2540","http://profit-shop.ru/shop/UID_12293.html","7e234be1c8b9948d4170ebfc4aaf09c9.jpeg"
"Прибор для ухода за кожей лица Gezatone Superlifting m355 с функцией светотерапии","<p><b>Прибор Gezatone Superlifting </b>создан для профессионального ухода за кожей лица в домашних условиях. Он быстро и без особых усилий поможет Вам избавиться от морщин и других возрастных изменений кожи. Регулярное выполнение несложных и не требующих много времени процедур позволит Вам значительно повысить упругость кожи, восстановить ее эластичность и тургор, улучшить цвет лица и разгладить морщины. Помимо лифтинга и увлажнения кожи прибор также выравнивает ее поверхность, разглаживает рубцы, воспалительные уплотнения и постакне. В основе работы устройства лежит метод «сонодермии», активно и успешно применяемый в профессиональной физиотерапии и косметологии уже на протяжении долгого времени. Во время работы излучатель прибора генерирует ультразвуковые колебания, которые заставляют ткани и клетки кожи волнообразно менять свою плотность. Такой деликатный массаж тканей на клеточном уровне оказывает мощное стимулирующее действие, не растягивая и не травмируя кожу. </p><p>Ультразвуковой микромассаж активизирует обмен веществ в клетках дермы, повышает уровень синтеза клетками коллагена и эластина, которые, как известно, придают тканям упругость и эластичность. Одновременно осуществляется разглаживание морщинок и борозд, активизируется циркуляция крови и лимфы. Ммассаж хорошо влияет на работу сальных и потовых желез, превосходно разравнивает поверхность кожи, рубцы, постакне и различные воспалительные уплотнения.</p><p>Световое излучение различается по длине волны, в зависимости от чего обеспечивает разные эффекты. Излучение синего спектра проникает в кожу на 0,5 мм. Оно подходит для чувствительной, жирной, воспаленной кожи. Этот вид излучения способствует регуляции выработки кожного жира, помогает при акне, сужает поры. Световое излучение красного спектра, проникая на глубину 8-10 мм, активизирует фибропласт. Нагрев способствует улучшению микроциркуляции, синтезу коллагена, росту новых здоровых клеток, а также сокращает глубину морщин, придавая коже гладкость и эластичность. Идеальное решение для проведения процедур в области лба и вокруг глаз. Световое излучение зеленого спектра подходит для кожи смешанного типа. Оно активизирует деятельность клеток, улучшает оксигенацию тканей, микроциркуляцию, оказывает успокаивающее действие на кожу, снимает дискомфорт. </p><p><b>Характеристики:</b></p><ul type=disc><li>Напряжение питания: DC 15 В; <li>сетевой адаптер: АС 220 В, 50 Гц/ DC15 В, 0. 4 А (или 0,8 А); <li>Потребляемый ток: 300 мА; <li>Вес 150 гр.</li></ul><p><b>Комплектация:</b></p><ul type=disc><li>Аппарат; <li>Сетевой адаптер АС 220 В / DС 15 В, 0. 4 А (или 0,8 А) - 1 шт. ; <li>Защитные очки – 1 шт.; <li>Руководство по эксплуатации.</li></ul><p><b>Показания к применению:</b></p><ul type=disc><li>Зрелая кожа с признаками увядания, дряблостью, сухостью, обвисанием контуров; <li>Формирование мимических морщин и бороздок; <li>Отеки, в том числе и вокруг глаз; <li>Бледность, плохой цвет лица; <li>Период реабилитации после травм и пластических операций; <li>Рубцово-спаечные деформации, постакне; <li>Купероз, телеангиэктазии.</li></ul><p><b>Производитель:</b> Gezanne.</p><p><b>Страна:</b> Франция.</p>","3650","http://profit-shop.ru/shop/UID_12294.html","7027adb71f2155ad74bf69c108416d64.jpeg"
"Вакуумный очиститель кожи с влажной функцией Gezatone Super Wet Cleaner","<p><b>Вакуумный очиститель </b><b>Gezatone </b><b>Super </b><b>Wet </b><b>Cleaner </b>позволяет осуществлять чистку пор кожи лица с применением очищающих косметических средств, что делает эту процедуру эффективнее, быстрее и приятнее. Прибор просто незаменим для удаления прыщей, угрей и других признаков проблемной кожи. Он убережет Вас от небезопасной ручной чистки пор, инфекций, не оставит следов и травм. <b>Gezatone </b><b>Super </b><b>Wet </b><b>Cleaner</b> также производит деликатный вакуумный массаж лица, улучшая при этом лимфодренаж, устраняя отеки и улучшая цвет и внешний вид кожи. Модель работает бесшумно.</p><p><b>Производитель:</b> Gezanne.</p><p><b>Страна:</b> Франция.</p>","1600","http://profit-shop.ru/shop/UID_12295.html","66244ec47caa50bd5231af5a58d04113.jpeg"
