"Комплект пародонтальных насадок к ирригатору (2 шт) DONFEEL OR-820M","<p>С давних пор людей неизменно заботит здоровье своих зубов, а  потому неудивительно, что уходу за зубами и полостью рта миллионы людей уделяют  огромное внимание. Одним из наиболее популярных приборов для профилактики  заболеваний полости рта является ирригатор. Особое внимание стоит уделять  насадкам к ирригатору. Комплект пародонтальных насадок к ирригатору DONFEEL OR-820M включает в  себя две сменные насадки с резиновыми наконечниками, предназначенные специально  для чистки чувствительных десен.</p> <p>Заботьтесь о своих зубах!</p> <p><strong>Характеристики:</strong></p> <ul type="disc">   <li>Тип:       пародонтальные;</li>   <li>Назначение:       для очистки чувствительных десен;</li>   <li>В       комплекте: 2 насадки;</li>   <li>С       резиновыми наконечниками.</li> </ul> <strong>Производитель:  DONFEEL (Россия/Тайвань)</strong>","270","http://profit-shop.ru/shop/UID_25824.html","141cd8baea6e8db6239edb8d6c9e1bdf.jpeg"
"Набор назальных насадок к ирригатору (2 шт) DONFEEL OR-820M","<p>На сегодняшний день одним из популярнейших приборов по уходу  за собой и своей внешностью является ирригатор. Однако особое внимание следует  уделить и аксессуарам к нему, а именно специальным насадкам. Набор назальных  насадок к ирригатору DONFEEL OR-820M включает в себя две сменные  насадки: одна – для воды для устранения заложенности  носа с помощью крупных капель, вторая – для  промывания воспаленных участках носоглотки мелкими каплями. </p> <p><strong>Характеристики:</strong></p> <ul type="disc">   <li>Тип:       назальные;</li>   <li>В       комплекте: 2 насадки;</li>   <li>Насадка       с синим наконечником: крупные капли воды для       устранения заложенности носа;</li>   <li>Насадка с черным наконечником: туман из       мельчайших капелек для промывания воспаленных участках носоглотки.</li> </ul> <p><strong>Производитель:  DONFEEL (Россия/Тайвань)</strong></p>","270","http://profit-shop.ru/shop/UID_25825.html","9a2bc44bf6a5d738109f051af1b10196.jpeg"
"Ирригатор полости рта Aquajet LD-A7","<p>Красивая улыбка сопровождает успешных людей. А что такое красивая улыбка? Это в первую очередь красивые ухоженные зубы. Уход за зубами включает в себя не только чистку зубов два раза в день, утром и вечером. Провести качественную читку зубов, уничтожить бактерии, очистить межзубное пространство и зубодесневые складки (область между основанием зуба и десной) поможет <strong>ирригатор Aquajet LD-A7.</strong></p><p>Известно, что промежуток между зубами – это то самое труднодоступное место, куда не может проникнуть обыкновенная щетка. Именно здесь скапливаются бактерии, приводящие впоследствии к кариесу и нарастанию зубного камня. Бактерии образуют кислотную субстанцию, которая разрушает эмаль зуба и, в дальнейшем, приводит к воспалению зуба и десны. Во время воспалительного процесса ткань десны постепенно отходит от зуба, позволяя болезнетворным бактериям скапливаться и проникать глубоко, вплоть до достижения челюстных костей. По мере разъедания кости бактериями, десны начинают съеживаться в направлении убывающей костной ткани. В результате появляется видимое удлинение зубов, по мере того, как ослабевает их поддержка деснами и челюстными костями. Это может привести к потере зуба. Или того хуже – атака бактериями может привести к нарывным процессам и возникновению кисты.</p><p>Признак затянувшегося пародонтоза – кровотечение десен. Применяя ирригатор постоянно, можно предотвратить этот процесс и вернуть деснам здоровое состояние.</p><p>Часто случается, что из-за недостаточности явных признаков стоматологами игнорируется появление зубного камня на ранних стадиях. Прибор Aquajet LD-A7 поможет остановить парадонтоз, гингивит, гниение зубов и, конечно, образование зубного камня.</p><p><strong>Ирригатор Aquajet LD-A7 </strong>позволит осуществить качественную очистку полости рта, включая зубы, язык, десна. Конструкция насадки ирригатора позволяет струе воды достичь области, недоступной при чистке обычной зубной щеткой или нитью. Мощный массирующий напор струи воды смывает остатки пищи, массирует десны и всю полость рта, улучшает кровообращение. Гидромассаж полости рта осуществляется с помощью теплой струи воды, которая подается под высоким давлением. Важно, что в воду, подаваемую ирригатором, можно добавлять лекарственные средства, лечебные отвары.</p><p>Поддерживать гигиену полости рта с помощью <strong>ирригатора Aquajet LD-A7 </strong>рекомендуется после каждого приема пищи. А время каждой процедуры занимает 5-10 минут.</p><p><strong>Особенности: </strong></p><ul type=disc><li>Эффективно очищает межзубное пространство и зубодесневые складки <li>Незаменим при использовании протезов, коронок и мостов <li>Имеет 4 скорости подачи струи, поэтому его могут использовать как взрослые, так и дети <li>В контейнер можно заливать воду или жидкость для полоскания рта, лекарственные и антибактериальные препараты для большей эффективности <li>Прибор имеет пылезащитный блок для гигиеничного хранения насадок <li>Регулирование напора: плавное, непрерывное <li>Возможно крепление к стене (шурупы в комплекте) </li></ul><p><b>Технические характеристики:</b></p><ul type=disc><li>Индивидуальные сменные насадки LD-SA01 <li>Питание: напряжение 220 – 230 В, частота 50 Гц <li>Потребляемая мощность: 40 Вт <li>Давление воды минимальное: 290 кПа <li>Давление воды максимальное: 810 кПа <li>Частота пульсации воды: 1200 импульсов/мин <li>Максимальное время непрерывного использования:10 минут <li>Время использования полного объема: около 1,5 мин <li>Емкость контейнера: 500 мл <li>Габаритные размеры: 180 х 175 х 145 мм <li>Вес (без упаковки): 1,35 кг </li></ul><p><strong>Сертификация:</strong></p><ul type=disc><li>Настоящий прибор соответствует европейским требованиям электробезопасности. Директива ЕЭС 73/23/ЕЕС <li>Разрешен к использованию в медицинской практике Минздравом РФ рег. № 2001/28 <li>Соответствует требованиям стандартов ГОСТ Р 50267.0-92 (МЭК 601-1-88),ГОСТ Р 50267.0.2-95 (МЭК 601-1-2-93) - Сертификат соответствия № РОСС.SG.ИМ02. А08565 <li>Сертификат TUV Rheinland № S1 2057736 от 06.11.2000 </li></ul><p><strong>В комплект входит: </strong></p><ul type=disc><li>основное устройство, <li>контейнер с крышкой, <li>задняя крышка для крепления прибора к стене, <li>пакет с шурупами и дюбелями, <li>4 насадки с полосками разного цвета, <li>инструкция на русском языке. </li></ul><p><strong>Производитель:</strong> Little Doctor International Pte Ltd (Сингапур)</p><p><strong>Гарантия:</strong> 12 месяцев</p><p><a href=\/pdf/lda7.pdf\" target=_blanck>Инструкция по эксплуатации Aquajet LD-A7</a> <img height=20 alt=\"\" src=\"http://www.profit-shop.ru/img/pdf.gif\" width=20 align=middle border=0></p>"","2500","http://profit-shop.ru/shop/UID_102.html","a49bb22ab9b1c7c4501855c8942e6cde.jpeg"
"Ирригатор полости рта DONFEEL OR-820M Комплектация 1","<p>Одним из наиболее популярных в настоящее время средств по  уходу за зубами является ирригатор. Стационарный ирригатор полости рта OR-820М (комплектация 1) имеет  увеличенную до 1,5 метров  длину сетевого шнура, микропузырьковую технологию очистки, функцию плавной  регулировки давления струи, а также отличные технические показатели. В  комплекте с этим ирригатором прилагаются две стандартные насадки, насадка  д/языка и пародонтальная насадка. Количество пульсаций насадок достигает 1200 в  минуту! Без сомнения, вас приятно удивит и привлекательный дизайн ирригатора  полости рта OR-820М –  данная модель выполнена в удачном сочетании белого и сиреневого цветов.</p> <p><strong>Характеристики:</strong></p> <ul type="disc">   <li>Тип:       стационарный;</li>   <li>В       комплекте: 2 стандартные насадки, насадка д/языка, пародонтальная насадка;</li>   <li>Увеличенная       с 1 м       до 1,5 длина сетевого шнура;</li>   <li>Напряжение       питания: 220-230 В;</li>   <li>Потребляемая       мощность: 35 Вт;</li>   <li>Количество       пульсаций в минуту: 1200;</li>   <li>Плавная       регулировка давления струи;</li>   <li>Микропузырьковая       технология очистки полости рта;</li>   <li>Цвет:       белый/сиреневый;</li>   <li>Инструкция       по эксплуатации, гарантийный талон.</li> </ul> <p><strong>Производитель:  DONFEEL (Россия/Тайвань)</strong><br>     <strong>Гарантия: 1 год</strong></p>","2890","http://profit-shop.ru/shop/UID_444.html","699c71eb95474070f11b71a4c8de6691.jpeg"
"Ирригатор полости рта Waterpik WP-70","<p>Провести качественную очистку зубов и лечебный массаж десен поможет <strong>ирригатор Waterpik WP-70.</strong> Совмещение чистки зубов с гидромассажем дает потрясающие результаты: очищаются труднодоступные для обыкновенной щетки места, массируются десны, приостанавливается развитие зубного камня. </p><p>Известно, что промежуток между зубами – это то самое труднодоступное место, куда не может проникнуть обыкновенная щетка. Именно здесь скапливаются бактерии, приводящие впоследствии к кариесу и нарастанию зубного камня. Бактерии образуют кислотную субстанцию, которая разрушает эмаль зуба и, в дальнейшем, приводит к воспалению зуба и десны.</p><p>Особенность модели <strong>Waterpik WP-70 </strong>заключается в том, что можно регулировать давление воды, поступающей из ирригатора. Пользователь может применять как обыкновенную воду, так и раствор с лекарственными средствами или ополаскиватель полости рта.</p><p>Ирригатор эффективно вычищает остатки пищи, застрявшей между зубами, мягко массирует десна, стимулируя приток крови. Следует отметить, что <strong>ирригатор Waterpik WP-70</strong> хорош для ухода за ортодонтическими конструкциями, например, коронками, зубными протезами. Точно направленные, пульсирующие струи позволяют прочищать области вокруг ортодонтических дуг, назубных колец, скоб и труднодоступных десневых борозд.</p><p><strong>Показания: </strong></p><ul type=disc><li>Профилактика кариеса и заболеваний пародонта (пародонтита) <li>Решение проблемы запаха изо рта <li>Чистка недоступных для зубной щетки участков <li>Самая эффективная чистка ортодонтических систем (брэкетов). <li>Специальные насадки <li>Решение проблемы кровоточивости десен <li>Уход за имплантатами, протезами <li>Профилактика периимплантита (отторжения имплантатов) <li>Профилактика болезней десен у людей, болеющих сахарным диабетом, усиление местного иммунитета <li>Профилактика кровоточивости десен (пародонтита беременных) у будущих мам <li>Снижение вероятности развития заболеваний десен у курильщиков </li></ul><p><b>Особенности:</b></p><ul type=disc><li>Семейная модель <li>Эффективность доказана в ходе клинических испытаний <li>Ортодонтическая конструкция <li>Возможно использование газированной воды <li>Регулятор давления воды <li>Эргономичная ручка с кнопкой «Пауза» и удобный скользящий переключатель, позволяющий перманентно контролировать давление жидкости <li>Отделение для хранения провода <li>Возможность присоединения силиконовых насадок с узким выходным отверстием для промывания пародонтальных карманов (продаются отдельно) <li>Поставляются вместе со скобой и винтами для возможного крепления к стене </li></ul><p><b>Технические характеристики:</b></p><ul type=disc><li>Давление воды: 220 – 620 кПа <li>Скорость: 1200 импульсов в минуту <li>Объем резервуара: 1 л</li></ul><p><strong>В комплект входит: </strong></p><ul type=disc><li>основное устройство, <li>4 струйных наконечника, <li>насадка для чистки языка, <li>сетевой адаптер, <li>комплект для крепления к стене, <li>инструкция.</li></ul><p><strong>Производитель: </strong>Waterpik Technologies (США)</p><p><strong>Гарантия:</strong> 1 год в авторизованном сервисном центре</p>","3500","http://profit-shop.ru/shop/UID_571.html","641d3cc1404ad4cab325411237f51a54.jpeg"
"Ирригатор полости рта Waterpik WP-100","<p>Хотите сохранить здоровые зубы надолго? Иметь красивую улыбку и редко посещать стоматолога? Все что вам нужно – регулярно пользоваться ирригатором. <strong>Ирригатор полости рта Waterpik WP-100 </strong>обеспечивает качественный уход за ротовой полостью, вычищает остатки пищи, снимает зубной налет, осуществляет мягкий массаж десен. </p><p><strong>Ирригатор Waterpik WP-100</strong> можно с успехом использовать для чистки языка, брекетов, парадонтальных карманов и других ортодонтических конструкций. Он достаточно компактен, чтобы брать его в дорогу и работает практически бесшумно.</p><p>Примечательно, что данная модель рассчитана на использование ирригатором всей семьей. <strong>Waterpik WP-100 </strong>имеет несколько насадок, что позволяет подобрать подходящую и осуществить максимально комфортную чистку зубов и мягкий массаж десен.</p><p><strong>WaterPik WP-100 </strong>– это не агрессивная и болезненная чистка полости рта, это приятная процедура, которая будет полезна всем членам вашей семьи!</p><p><strong>Показания: </strong></p><ul type=\disc\"><li>Профилактика кариеса и заболеваний пародонта (пародонтита) <br>Решение проблемы запаха изо рта </li><li>Чистка недоступных для зубной щетки участков </li><li>Самая эффективная чистка ортодонтических систем (брэкетов) </li><li>Специальные насадки </li><li>Решение проблемы кровоточивости десен </li><li>Уход за имплантатами, протезами </li><li>Профилактика периимплантита (отторжения имплантатов) </li><li>Профилактика болезней десен у людей, болеющих сахарным диабетом, усиление местного иммунитета </li><li>Профилактика кровоточивости десен (пародонтита беременных) у будущих мам </li><li>Снижение вероятности развития заболеваний десен у курильщиков </li></ul><p><strong>Особенности: </strong></p><ul type=\"disc\"><li>Удобный, эргономичный дизайн </li><li>Самый тихий в эксплуатации </li><li>10 уровней давления воды </li><li>Эргономичная ручка с кнопкой «Пауза» и удобный скользящий переключатель, позволяющий перманентно контролировать давление жидкости </li><li>Возможность использования с лечебными и профилактическими растворами </li></ul><p><b>Технические характеристики:</b></p><ul type=\"disc\"><li>Давление воды: 220 – 620 кПа </li><li>Емкость резервуара для жидкости: 0,6 л. </li><li>Питание: напряжение 220 В </li><li>Габаритные размеры: 165 х 140 х 220 мм</li></ul><p><strong>В комплект входит: </strong></p><ul type=\"disc\"><li>основное устройство, </li><li>стандартные насадки (3 шт.), </li><li>насадки для чистки языка (3 шт.), </li><li>насадка для глубокой чистки десневых карманов, </li><li>орто-насадка для очистки брэкетов и ортопедических работ, </li><li>адаптер, </li><li>инструкция.</li></ul><p><strong>Производитель: </strong>Waterpik Technologies (США)</p><p><strong>Гарантия: </strong>1 год в авторизованном сервисном центре</p>"","4600","http://profit-shop.ru/shop/UID_572.html","c6d699daf666463f9b839fa82bf8ede0.jpeg"
